{
  "task_id": "FRONT-PJT-CASE-04-MTG-CASE-04-04",
  "checked_at": "2026-05-04T12:50:25.175Z",
  "required_sources": [
    "Base 记录",
    "云文档",
    "会议/妙记"
  ],
  "optional_sources": [
    "Base 历史",
    "聊天历史",
    "日历",
    "通讯录"
  ],
  "available_sources": [
    "Base 记录",
    "Base 历史",
    "云文档",
    "会议/妙记",
    "通讯录"
  ],
  "missing_sources": [
    "聊天历史",
    "日历"
  ],
  "degrade_reasons": [
    "聊天历史 缺失",
    "日历 缺失"
  ],
  "blocking_reasons": [],
  "source_checks": [
    {
      "source_name": "Base 记录",
      "required": true,
      "status": "available",
      "sample_count": 43,
      "files": [
        "03_task_risk_register/base_projects_record_list.json",
        "03_task_risk_register/base_tasks_record_list.json",
        "03_task_risk_register/base_risks_record_list.json",
        "04_meetings/base_meetings_record_list.json",
        "04_meetings/base_statements_record_list.json"
      ],
      "notes": []
    },
    {
      "source_name": "Base 历史",
      "required": false,
      "status": "available",
      "sample_count": 5,
      "files": [
        "03_task_risk_register/base_record_history_list.json"
      ],
      "notes": []
    },
    {
      "source_name": "云文档",
      "required": true,
      "status": "available",
      "sample_count": 1,
      "files": [
        "01_cloud_docs/docs_fetch_main_doc_v2.json"
      ],
      "notes": []
    },
    {
      "source_name": "聊天历史",
      "required": false,
      "status": "missing",
      "sample_count": 0,
      "files": [
        "02_chats/im_chat_search_user.json",
        "02_chats/im_messages_search_user.json"
      ],
      "notes": []
    },
    {
      "source_name": "会议/妙记",
      "required": true,
      "status": "available",
      "sample_count": 11,
      "files": [
        "04_meetings/base_meetings_record_list.json",
        "04_meetings/minutes_search_user.json",
        "04_meetings/minutes_transcript_case04.json",
        "04_meetings/vc_search_by_participant.json"
      ],
      "notes": [
        "当前会议没有完整妙记转写，只能依赖会议表和其他留痕"
      ]
    },
    {
      "source_name": "日历",
      "required": false,
      "status": "missing",
      "sample_count": 0,
      "files": [
        "06_calendar/calendar_events_instance_view.json"
      ],
      "notes": []
    },
    {
      "source_name": "通讯录",
      "required": false,
      "status": "available",
      "sample_count": 8,
      "files": [
        "05_org_and_team/contact_get_user_user.json",
        "05_org_and_team/contact_search_user_project_members.json"
      ],
      "notes": []
    }
  ],
  "sample_checks": [
    {
      "check_name": "evaluation_target.manager_id",
      "status": "pass",
      "detail": "present"
    },
    {
      "check_name": "evaluation_target.manager_name",
      "status": "pass",
      "detail": "present"
    },
    {
      "check_name": "evaluation_target.project_id",
      "status": "pass",
      "detail": "present"
    },
    {
      "check_name": "evaluation_target.evaluation_period",
      "status": "pass",
      "detail": "present"
    },
    {
      "check_name": "project_snapshot_count",
      "status": "pass",
      "detail": "1"
    },
    {
      "check_name": "meeting_record_count",
      "status": "pass",
      "detail": "4"
    },
    {
      "check_name": "current_meeting_id",
      "status": "pass",
      "detail": "MTG-CASE-04-04"
    }
  ],
  "recommended_actions": [
    "补充辅助样本：聊天历史 缺失",
    "补充辅助样本：日历 缺失"
  ]
}